{
  "schema": "atlasent-trust-root/v1",
  "issued_at": "2026-09-26T00:00:00Z",
  "valid_until": "2027-06-01T00:00:00Z",
  "trust_root_signer": {
    "sigstore_identity": "https://github.com/Atlasent/atlasent-keys/.github/workflows/publish-trust-root.yml@refs/heads/main",
    "oidc_issuer": "https://token.actions.githubusercontent.com"
  },
  "resources": [
    {
      "path": "/.well-known/atlasent-verifier-keys.json",
      "sha256": "d30011a704ada439c3abd711c15473b0a845183b4adc41a913ceaaf242b27e61",
      "sig": "/.well-known/atlasent-verifier-keys.json.bundle"
    },
    {
      "path": "/.well-known/atlasent-sigstore-identities.json",
      "sha256": "2adf93980a6c4e15a35d1df84f5fd94551133669efed7530e7115934dbe9a08e",
      "sig": "/.well-known/atlasent-sigstore-identities.json.bundle"
    },
    {
      "path": "/.well-known/atlasent-revocations.json",
      "sha256": "73ee83e788203d8e3ae93d33625e234f0f0724adb47537c72554fd7f2ed84ff5",
      "sig": "/.well-known/atlasent-revocations.json.bundle"
    }
  ],
  "v2_anchors": {
    "transparency_log_url": null,
    "transparency_log_pubkey": null
  }
}
